review,rating
"Hey guys,
(This review is after 7 days usage)
I had purchased boAt Bassheads 900 Wired On Ear Headphones with Mic (Carbon Black) and the boAt Bassheads 900 Wired On Ear Headphones with Mic (Pearl White) 7 days ago for 749 and 799 respectively.

Pros
1. For the price, these headphones are a bang with amazing bass.
2. Very comfortable and has a pretty strong head band with soft leather cushion.
3. The one side wire design is so helpful, especially when you go out for a walk.
4. Fits snuggly (not too tight not too loose) and doesn't fall off that easily.
5. When you put it on your ears (even without music), the person who is talking to you, in the same room, will have to yell for you to hear them; so that's a blessing if you have to study for long hours and you want absolutely no one to disturb you.
6. Very easy to store, as the ear cups bend inwards.
7. Works on all devices.
8. The leather quality of the earcups and head band are very good.

Cons
1. Since I have glasses, the frame of my glasses is always behind my ear and for long durations of usage of the headphones, it does hurt until you get used to it.
2. For video or audio calls, you should be in a quiet room and not below the fan directly as those sounds are louder than you (the speaker).
3. Need to use at at least 75% volume to feel the effect of the song.
4. The springs of the ear cups are pretty loose on purpose to give you the snuggle fit (can be a pro or con).

P.S. the white looks much better than the black if you can maintain the whiteness for long.

These are the pros and cons I found with 7 days experience.

If this review was helpful, kindly hit the 👍 icon!

Thank you✨",4.0 out of 5 stars
Best product in this price range.,4.0 out of 5 stars
Thik thak hai.sound quality good,4.0 out of 5 stars
Great build quality. Great design. Great sound. boAt never fails to amaze.,5.0 out of 5 stars
Ok theek hai,4.0 out of 5 stars
The sound quality is good but the length of the wire was short so keep it in mind,4.0 out of 5 stars
" Very good bass
Adjustable
Look good
And good build quality",5.0 out of 5 stars
"Awesome Product at this price range, sound quality is superb, bass is lower than it says, any ways good product",4.0 out of 5 stars
The headphones has stopped working in 3 to 4 months though it was in the warranty period. Very bad experience with boat,3.0 out of 5 stars
"sound,noise quality is really best. we are satisfied to purchase the goods.",4.0 out of 5 stars
Good Quality of sound under the budget. I am completely satisfied with it.,4.0 out of 5 stars
"Everything is perfect in this product,the sound quality,the noise cancelation,the bass quality, everything is just good.",5.0 out of 5 stars
"Good product, Sound Quality is Good, Lightweight, Cable length is sufficient
Compatible with Both Mobile and Computer",5.0 out of 5 stars
"At par with quality you expect from Boat headphones (especially on ear headphones)
Bought it for ₹649/-
It's leather padding helps mitigate any pain caused by wearing such headphones for longer period of time.
Sound quality is pretty good, I brought it to to use for Zoom calls on my office laptop.
It has metallic wux cable, which I loved because it makes headphone more durable for me.
I wish it had noise cancellation feature.
4/5 for me.",5.0 out of 5 stars
Audio very clear. No noise. Super product,5.0 out of 5 stars
Everything is good but wire length is little short.,4.0 out of 5 stars
Both are good.,5.0 out of 5 stars
"I'm using this headphone on my pc from the last 6 months roughly... It dropped more than 20 times, plugg was pulled of still i hava faced no problems with this product, such a good Budget headphones",4.0 out of 5 stars
"I'm using this headphone on my pc from the last 6 months roughly... It dropped more than 20 times, plugg was pulled of still i hava faced no problems with this product, such a good Budget headphones",4.0 out of 5 stars
One side stopped working after 2 or 3 weeks,3.0 out of 5 stars
"The product is awesome, but if you want best product just click below link and enjoy:👇👇👇

https://amzn.to/3JzG7LC",5.0 out of 5 stars
Product quality is very good. No issues after 2 years usage.,5.0 out of 5 stars
Good,4.0 out of 5 stars
It's Good but not very good 😜😜,5.0 out of 5 stars
The pads are soft,4.0 out of 5 stars
It's average. Noise cancellation not there,4.0 out of 5 stars
Light weight and easy to use. Good product,4.0 out of 5 stars
Light weight and easy to use. Good product,4.0 out of 5 stars
Light weight and easy to use. Good product,4.0 out of 5 stars
"I wanted to get a wired Headphone and chose this (since I already had a Bassheads 900 and liked that one).

This one is definitely more comfortable for extended usage (size of the ear cup and the comfort, both are good). Happy with the sound quality for my use.

Only downside is the wire lenght. It's too short (considering how long the 900's was). But for that, will recommend the product.

Hope boAt introduces more models in the wired range.",4.0 out of 5 stars
Very good for office meetings,5.0 out of 5 stars
"Excellent sound and bass
only problem is if we use for longer duration ear starts to pain
other than that it is excellent product",5.0 out of 5 stars
I like this product,5.0 out of 5 stars
This is real value for money. It is 80/85% to Sony and other headphone at much cheaper price.,4.0 out of 5 stars
Worth it.. Ear pain is the major drawback.. Otherwise a Good product..,4.0 out of 5 stars
Excellent product good performance go for it,5.0 out of 5 stars
"The pads are same as boat rockers 450 but sound is great, and build quality is not up to the mark",3.0 out of 5 stars
Choose wisely..as per the application..!!,3.0 out of 5 stars
I dont expect much from this product. But even than atleast basic sound quality needs to be clear. Here there is a permanent crackling sound which makes the headphone useless for any voice calls.,3.0 out of 5 stars
This headphone use in 3 year's. It is no sound quality problem and no bass problem,4.0 out of 5 stars
" If want headphones around 1k then don't hesitate these are damn to worth headphones in this range. Firstly I didn't expect to much from these but after using a bit while, I find these are one of the best buy from me. Bass quality is awesome and very comfortable to wear, the jack is also to good which gives the overall product quality 5*.",5.0 out of 5 stars
" If want headphones around 1k then don't hesitate these are damn to worth headphones in this range. Firstly I didn't expect to much from these but after using a bit while, I find these are one of the best buy from me. Bass quality is awesome and very comfortable to wear, the jack is also to good which gives the overall product quality 5*.",3.0 out of 5 stars
A,5.0 out of 5 stars
 Ek number,5.0 out of 5 stars
"The material quality is worth for the price, the sound quality is good but it seems there is extra noise, bass is also good expect for the noise.
And another drawback is that your ears start to pain after 10-20 mins of wearing it. Comfort is on a downside. Still its commendable for its price compared to other brand headsets.",4.0 out of 5 stars
Best audio quality,5.0 out of 5 stars
"Sound is good but very hard material so after using 3-4 hours, start paining in head and noise area. Not much comfortable to for continueous use",3.0 out of 5 stars
 Sound quality is too good.👍👍👍,5.0 out of 5 stars
"for bass lovers it's fantastic, it's catching small frequency too so overall a good product you can hear each beat. you can use it for a long time because it's not pressing your ears so no pain with enjoyment",4.0 out of 5 stars
Good product,4.0 out of 5 stars
"Cushions are bit bulky, sweaty and feel hard on ear parts. Bass sound is fair but it kills clarity of other music elements. It's a good product for the budget though.",3.0 out of 5 stars
Product is good but I don't like heavy bass that's why I didn't like the sound much.,4.0 out of 5 stars
I don't like this product. Sound not works,3.0 out of 5 stars
It's quite nice for this kinda cost and I personally trust boat👍👍,4.0 out of 5 stars
Value for money,4.0 out of 5 stars
Value for money,4.0 out of 5 stars
This Price is so very nice products,4.0 out of 5 stars
voice is clear and good base,4.0 out of 5 stars
" Everything is good in this headphone.
Good product at such price.",4.0 out of 5 stars
" Everything is good in this headphone.
Good product at such price.",4.0 out of 5 stars
" Everything is good in this headphone.
Good product at such price.",3.0 out of 5 stars
"Product looks good, but sound quality is not worth for what we have paid.

Too much bass, so no clarity.",3.0 out of 5 stars
Very comfort. Light weight.,5.0 out of 5 stars
best headphone,4.0 out of 5 stars
"Sound clarity, volume and bass are all good. Recommended. 👍",5.0 out of 5 stars
Headphone cable length is short,3.0 out of 5 stars
Please improved Weird,4.0 out of 5 stars
" Sound quality is good
Bass 🔊quality is good
But
You can't listen Sound more than 10 minutes longer because your ears are closed not passing air.. this will be irritating 🙄 you before few minutes don't buy
I have this product but I am not using this for one hour any day after purchase 😅",4.0 out of 5 stars
"Pros:
1. It's a good quality product.
2. Foam in the ear pads are soft, ergonomic, yet made of good materials, ensures long life.
3. Overhead plastic is made of good material.
4. Value for money product.
5. Being it wired headphone, you don't have to worry about charging it.
6. Adjustable for different head sizes.
7. Sound quality is good.
8. Perfect product for remote working/ business call/ WFH/ online classes uses.
Cons:
If it's placed over the ears for long duration, one could feel, something is pressing the ears. The feel to the ears is something similar to wearing a new helmet makes the press on the ears.",5.0 out of 5 stars
"Best headphone, budget friendly",5.0 out of 5 stars
"Great product
Great noise
Great AMAZON
THANK YOU AMAZON...........",5.0 out of 5 stars
I feel like a theatre,4.0 out of 5 stars
"Nice ,can use it roughly ! My son uses for online class n is happy to use it !",5.0 out of 5 stars
"experiencing a good sound effect, only plug is little harder and not sitting properly",5.0 out of 5 stars
"I got this product for just 550 rupees it's really value for money and noise quality,bass etc... Is upto mark. This head phone actually doesn't claim noise cancellation, it is actually noise isolation thus it is superb in that too",5.0 out of 5 stars
"I got this product for just 550 rupees it's really value for money and noise quality,bass etc... Is upto mark. This head phone actually doesn't claim noise cancellation, it is actually noise isolation thus it is superb in that too",5.0 out of 5 stars
"I got this product for just 550 rupees it's really value for money and noise quality,bass etc... Is upto mark. This head phone actually doesn't claim noise cancellation, it is actually noise isolation thus it is superb in that too",4.0 out of 5 stars
I like it because of good sound quality,4.0 out of 5 stars
Best,5.0 out of 5 stars
"I bought it in 2018, and still it is working very fine. The body is very strong, wire is excellent. Only thing that may suffer you after 2-3 years is the foam in cups. I ordered one in 2018 and then I ordered 5 for every member of my family in 2019 from sale... It is the best product I have ever used. I have no words to describe how worthy it is, I can say please don't waste a single second, go for it. You'll realise why I'm saying this",5.0 out of 5 stars
"The sound quality is good. However, the mic isn't that great for calls while using apps such as Teams, Zoom, etc,. Users on the other end complain that my audio sounds like I'm talking from far away.",4.0 out of 5 stars
Its over all a very good product I used it for a long time very durable and nice sound quality and probability.,4.0 out of 5 stars
Perfect headphones BUT some fitting issue makes them crush your ears,3.0 out of 5 stars
Very nice headphone by boAt in this price range. High quality bass. 😌🎧,5.0 out of 5 stars
Comfort And Voice quality is good,5.0 out of 5 stars
the product is as same as narrated in discription but it seems tight on both end the voice is very clear with extra bass it's good for noraml price range headphone lovers,4.0 out of 5 stars
the product is as same as narrated in discription but it seems tight on both end the voice is very clear with extra bass it's good for noraml price range headphone lovers,5.0 out of 5 stars
"Thesenis not comfortable for long time use like 3 to 4 hours continuously. But I can't use these headphones for long time, because it's not feeling comfortable for ears.",3.0 out of 5 stars
"it's a really nice product considering the price. I paid 649 rupees for it and at this price, it is very nice. I bought it for my office meetings and seems a good choice in budget.",4.0 out of 5 stars
I Love to listen music very much....And this product is cherry on the top...Sound quality is amazing...I already gave my ratings about these product,5.0 out of 5 stars
Nice long wire super bass and sound. I use it for laptop and Android phone,5.0 out of 5 stars
"Genuine review after 2 weeks of use. Excellent sound quality, bass and design.
Onear comfort is fine but if you are wearing specs and going to use headphones for a long time it will press your ear along with frame, little bit painful for long usage. But for short time it will not cause any pain or discomfort.
During call, mike is working good oposite person can hear our voice fine. But some dizzling and cracking sound is coming from the speakers during phone call. Due to this problem i am giving 4 star but for music point of view I'll give 5/5.
Sponge near ear and head area will be teared after long term use, so try to keep it safe. Overall, music lovers will love it😘😘.
Worth full go for it.
I bought it for 599(free delivery).
And I too love it😍🥰😘.",4.0 out of 5 stars
"Genuine review after 2 weeks of use. Excellent sound quality, bass and design.
Onear comfort is fine but if you are wearing specs and going to use headphones for a long time it will press your ear along with frame, little bit painful for long usage. But for short time it will not cause any pain or discomfort.
During call, mike is working good oposite person can hear our voice fine. But some dizzling and cracking sound is coming from the speakers during phone call. Due to this problem i am giving 4 star but for music point of view I'll give 5/5.
Sponge near ear and head area will be teared after long term use, so try to keep it safe. Overall, music lovers will love it😘😘.
Worth full go for it.
I bought it for 599(free delivery).
And I too love it😍🥰😘.",4.0 out of 5 stars
Good product,4.0 out of 5 stars
Good 😊,5.0 out of 5 stars
"Great sound great design
The outter paint coating is not so good
Mic quality could have been better",4.0 out of 5 stars
I like sound quality,5.0 out of 5 stars
Hi how to avail service during warranty period. My Headphone not working properly.,5.0 out of 5 stars
Very good product..,4.0 out of 5 stars
Bass is low compared to another old same unit,3.0 out of 5 stars
"Bass is really good! Sound quality is decent enough for the price. The ear paddings are toooo small, huts after a around 30-40 mins of usage :(
The 3.5mm jack is built super good! Other than the uncomfortable wearing experience after a few mins it's very much worth it!",4.0 out of 5 stars
"Serves the purpose but can't wear them for long time, ears will get pain.",5.0 out of 5 stars
"its good , comfortable 👍",4.0 out of 5 stars
Gud headphones but only comfortable till 2 hrs. But at this price it's is beast sound,4.0 out of 5 stars
The bassheads 900 is the perfect option for one who wishes to forget the world and enjoy music. The bass is so good with noice cancellation. The quality of sound is amazing.,4.0 out of 5 stars
"The best bass you can get in affordable price but sound quality and noise cancelling is medium.
My ratings:
Bass: 4.3/5
Noise cancellation: 4/5
Noise leakage: 3.5/5
Comfort: 3/5
Music: 4.5/5
Design: 4/5
Overall: 4.2/5
Edit ( after 2 months of use) :

Headphones is still at their best and I haven't faced any single problem and i literally use it 15 hours a day

I bought it for 600rs and this headphone definitely is the best under 1000rs

So just go for it if you're looking for a wired headphone under 1000rs",5.0 out of 5 stars
"Sound guality good, but ear 👂 pain 😢",4.0 out of 5 stars
Cable is very short and we can't use it properly with our office desktop. Loudness is also not proper otherwise Bass is good.,3.0 out of 5 stars
I bought it on 26sep 2021 till now it's working amazingly good. Very light. Easy to carry. Amazing product from Boat.. Performance is far better than i expected. Bass is wonderful 😍. Audio quality is better than many other headphones . Initially i got ear pain( over a month of period) but once the headphones become flexible it will be awesome.. it's more than Worth for the money..Go for it..,4.0 out of 5 stars
 Super cool,5.0 out of 5 stars
"Sound quality is very bad.
Good quality and flexibility to fold
Bass is average",3.0 out of 5 stars
"I bought this product a few months ago and I’d say the quality is very good for the price , the only problem is the small comfort issue if worn for a long time . The music quality id phenomenal for the price and the build quality is good if u handle it carefully( that means not swinging it around or throwing it anywhere) I will say tho that the fact that the headphones are on ear may act as a disadvantage sometimes but overall still a good product .",4.0 out of 5 stars
Average&e,3.0 out of 5 stars
Hurts in the ear.,4.0 out of 5 stars
Bass is best,5.0 out of 5 stars
Incredible bass,5.0 out of 5 stars
I like it,5.0 out of 5 stars
" Good for listening music, Geeting disturbance in calls",3.0 out of 5 stars
Mast hai bhai... Magar 600 tak mai mile tabhi lena,4.0 out of 5 stars
Heavy Bass and very clear sound,5.0 out of 5 stars
"Using it for online meeting, and it's very good.",5.0 out of 5 stars
It's ok,3.0 out of 5 stars
Reasonable price and best quality,5.0 out of 5 stars
Mike is not upto the mark,4.0 out of 5 stars
"Probably the best headphone in the market for under Rs. 1k as of now.
Build quality is as one would expect from a budget headphone, but i have definitely seen worst even at around Rs 1000 category. Ear coushions are ok, not as soft as i would prefer them to be, but on bad either. The mai issue if you ask me is that the headphones are little lose on the head, and no, i dont have a small head, i have average head size, i would have liked it a little bit tighter.
Coming to sound quality, as i said before, these are the best headphones under the 1k price category. But you should not forget that these costs 600 inr only. So dont go expecting the sound output like that of good lower end headphones which costs Rs. 2000+. The lows and mids are decent, but as you increase the volume, you can feel the just a little bit of distortion and at full volume, you can tell that base is overpowering the treble but that too is not as clwar as you would like it to be. But then again, you can not get anything better in under 1k price category.
So yeah, if your budget is under 1k and you are fine with a wired on-ear headphone and has a slightly bigger head, then this is the only choice for you as of now.",3.0 out of 5 stars
Good,5.0 out of 5 stars
Good,5.0 out of 5 stars
 My one side headphone is not working and sound quality Has also declined …We are very dissapointed from this product.I want a new one in return as soon as possible,4.0 out of 5 stars
Nice product,5.0 out of 5 stars
Like,5.0 out of 5 stars
Headache start when used for long time. though I am unable to locate the right cause what I found is that Sony headphone can be used for long time without any discomfort.,3.0 out of 5 stars
Superb HEADPHONE I WILL BUY WHEN PRICE IS 549 INCLUDING BANK OFFER . SOUND IS GOOD AS WELL BUILT QUALITY IS ALSO GOOD,5.0 out of 5 stars
"In my unit One of the earcups is loose, and if you use it for a little more than 15 min. your ear starts to hurt(gotta use the Jugar). But overall i'm somewhat satisfied.",4.0 out of 5 stars
"I am a music freak and listen to all kinds of music (except Electronic Cacophony). I have used many top end headphones & can sagaciously rate this headphone.
- Amazing sound quality, if you alaign the tabs of inbuilt Equaliser in your phone.
- Light weight.
- Moderately fine build quality in this price range.
- ""Bass is a personal choice, I admire clarity than jarring, uncomfortable Bass, and this Headphone is doing justice to a good extent.

I am strongly recommending this product to one and all music enthusiasts with a tight budget....... I swear, this Headphone won't disappoint you.",5.0 out of 5 stars
Good quality to take calls,5.0 out of 5 stars
"The sound quality is great, it is pretty stylish. I would definitely recommend this especially in this price range.
Two cons I observed are -
1) It does pain your ears if you wear it for a long time. The fit is too tight.
2) On high volumes, others can hear what you are listening to.",4.0 out of 5 stars
Best products to buy,5.0 out of 5 stars
"Lasted only 6 months, wires near the speakers came out, inspite of decent handling. Should be more sturdy near the speakers, rest is fine",4.0 out of 5 stars
"Been using this product for 5 months. I am impressed with it's build quality which is adequate for rough daily use. It'a a very rugged product.
1. Cable has thick insulation and it almost 5 feet long.
2. The 3.5mm jack is made of metal(stainless steel I believe).
3. The jack has a spring so that the cable doesn't get stretched when you pull it out.
4. Overall body looks very solid. It is not made of cheap/fancy/breakable plastic like in other headphones.
5. Sound quality is quite well with decent bass. Didn't get any distortion at loud volume.

I liked this product.",4.0 out of 5 stars
Good product at reasonable price point. Good sound quality,5.0 out of 5 stars
"Very good sound and bass. All of very good and very lowest price.
Thanks Amazon",5.0 out of 5 stars
"Good headphones overall for this price best choice
BOUGHT IF FOR 599 INR
writting review after 1 day usage
had used many boat products before

#PROS:--
*sound quality is best in this price range (5/5)
highs are very crisp , mids are clear, but lows are
almost killed due to addition of extra bass.
*build quality is descent nothing too special or
fancy , specially it is light weight still feels solid
*3.5 mm Jack is made up of metal and comes with a
spring and spring prevents it from breaking wire in
long term rough use
*padding is ok can wear it for 1 to 1.5 hrs after that
ears starts to pain.

# major CONS :--
* THE VERY SERIOUS ISSUE IS THAT WHEN U PLAY
MUSIC THE SOUND LEAKS OUTSIDE
i mean if very less sound is leaked then its ok but it
is extremlu loud even it can be annoying to u as
anyone sitting beside you can hear what r u
listening . for refrence u can take u r playing musuc
with your phone at volume at 2 level with ur
phone's speaker than the sound u hear is as same
as the sound leaked from headphones.

*as they are on ear headphones they r not too
comfortable specially for long time of continuous
use . So if uh spend more than 2 hrs. continuously
then better add some more money and get over
ear headphones

# minor CONS :--
*3.5 mm Jack is not gold plated
*no bearded or kevelar cable like usb cable and aux
cable made by boat, its just plastic with ok quality
*the microphone button is very tight/hard to press
and requires a bit of extra force which is annoying
*their is no seal on box (this is not only my case )for
this headphones u never get seal on box . Common
boat wtf is this its just a piece of tape .
*if u wear galsses then u should have to remove
them as the frame of glasses sits behing ur ear and
the headphones apply inward pressure on ur ear so
ur ear may start to pain due to glasses

I HOPE IN NEST VERSON OF PRODUCT BOAT WILL FOX THEASE ISSUES

And a request to amazon that the headphones took me 5 days to reach me plz dont take more than 2 days delivery time its very BAD",4.0 out of 5 stars
I am reviewing this after ussage of this beast for two years. I have both black and white. Am huge fan of loud music but i cant go above 40% of volume this headphone it so loud clear and base is awesome. Just go for it. U will never regret for this. This is best wireed headphone of boat it looks so classy.,5.0 out of 5 stars
Good product,4.0 out of 5 stars
Can't hold for long it hurts ears as ear domes are small,3.0 out of 5 stars
 Ok,3.0 out of 5 stars
Do buy this Good product using since 4 years of purchase not a single danger to the product,5.0 out of 5 stars
Nice product,3.0 out of 5 stars
"Sound quality is awesome
But microphone is not working properly",3.0 out of 5 stars
"Yes, it's got punchy Bass but it's not the way to listening music.
the only way to utilize the headphone in a correct way is to use a good music player on the phone like poweramp and adjust the equalizer to match the frequency to the headphone
after that, this is amazing for listening to thumpy beats or to classical or even to light melodies
not good for long usage though as its heavy to wear",4.0 out of 5 stars
Ye Headphone MOTO G5S Plus Smartphone ke liye best compatible hai !! Aur Laptops ke liye Lajawab !!,4.0 out of 5 stars
Ye Headphone MOTO G5S Plus Smartphone ke liye best compatible hai !! Aur Laptops ke liye Lajawab !!,5.0 out of 5 stars
If You Want Ear Shaking bass. Then Grab this headphones as soon as possible.,5.0 out of 5 stars
Poor sound quality,3.0 out of 5 stars
"I believe the brand boAt alot .
But this product has lost my trust coz its mike is not working properly .
When i speak in skype , the receivers are unable to hear my voice .",4.0 out of 5 stars
