review,rating
Kk,5.0 out of 5 stars
The voice is coming only in one side,3.0 out of 5 stars
"Good product but the on ear bush is not soft slough, it pains",3.0 out of 5 stars
Very nice,5.0 out of 5 stars
"Most impressive of this product is its bass quality & overall sound quality is pretty good.
One negative is feeling some discomfort to pinna of the ear (not ear pain)no noise cancellation(its's ok with this prize range)
Overall a top quality headset, one of thr best among this prize range. Surely value for money",4.0 out of 5 stars
Good,4.0 out of 5 stars
"Good in quality nice bass clear sound

Only for movie and music ( 7/10)",3.0 out of 5 stars
Before this I had used earphones that was not that comfortable...now I bought this and sound quality and comfort is superb...so go for it must buy...,5.0 out of 5 stars
This is really a great headphone with cheap price. I am not sure about noise cancellation as I do not see it working. But the sound is good. The size of headphone is a bit larger and if you adjust it. It does not fit properly.,4.0 out of 5 stars
Sound quality super bass quality 👍,4.0 out of 5 stars
Sound quality super bass quality 👍,4.0 out of 5 stars
It's cool and really amazing but I wish it to be more hardy,4.0 out of 5 stars
Nice product,5.0 out of 5 stars
Nice product,5.0 out of 5 stars
I love these boat headphones i am using it from last 4 years I have but 3 headphones of it And all give me best ever performance you can definitely go for it 👌👌👍👍,5.0 out of 5 stars
like .....❤️,4.0 out of 5 stars
These are the best quality headphones for it's price in the whole world perhaps. Better than any other multinational companies. We should be proud of buying these phones as they are made in India by an Indian company.,5.0 out of 5 stars
"Bass best..
Noise cancellation best
But not clear footsteps in pubg",4.0 out of 5 stars
"It was a branded company but headphones were poor . My old headphones Novateur r11 were cheaper and much better than it , I will suggest you to take them. This boat headphone have very narrow band which doesn't fit in head. Bs up-down hota rhta head pr. Bass quality bhut bkwaas h blki baas toh jaise h hi nhi and noise Cancellation toh h jo nhi bkwaas h ...sound quality thodi thik h ....wire ki quality bhut bkwaas h , mai haat se hi tod skta hu. Saath hi dono woofer bhit irritating h kyuki hr disha mai ghum jaate h apne asap and kaan mai toh ek hi jgh se lgaate h ....bhut bkwaas Design h . .bt iss price mai boat k headphones h isliye thik h but I will suggest you to buy novateur r11 headphones as they are much better in this price",4.0 out of 5 stars
first of all audio quality is good but sound is not enough you have to increase volume by 60% ear cushions are comfortable and wire is not detavhable so you have to keep it on,4.0 out of 5 stars
Nice👍,5.0 out of 5 stars
Good product but not full ear cover,4.0 out of 5 stars
"I have been using this headphone for last 3 years and I have used 2 of them during this period. The first one's mic stopped workiny after a year hence got the other one. But both of their audio is working amazing. At this price point, it even beats wired headphones even around 2k. The bass is amazing. Noise cancellation is decent but these dont claim to be completely noise cancelling. I'm not a fan of bluetooth headphones due to latency, hence these work best for me. Hope they never stop this model ever.",5.0 out of 5 stars
"A bit too much bass and other sounds are a bit muddy but its bang for your buck.
The Built in microphone is nearly useless don't even consider using it.",4.0 out of 5 stars
"A bit too much bass and other sounds are a bit muddy but its bang for your buck.
The Built in microphone is nearly useless don't even consider using it.",4.0 out of 5 stars
No.1 sound quality,4.0 out of 5 stars
No.1 sound quality,4.0 out of 5 stars
this is tha indian prodct iove u boat gread job nic,5.0 out of 5 stars
"Previously I was using Philips on ear headphones, as compared to them this product is average",4.0 out of 5 stars
Nice product,5.0 out of 5 stars
"Bass is not that good, Not expecting great sound bass clarity or sound from this price range. Really good product.",4.0 out of 5 stars
Been using it for more than 3 years every single day but still it works like i brought it yesterday. Though it now looks worn out because of usage but the sound quality is just amazing.,5.0 out of 5 stars
The good sound quality in this price range I am using this for meeting Wfh it is fine I surely recommend it,4.0 out of 5 stars
Product is superb sound quality also osm for gaming is also good but ek problem he iske earcups chote he is liya ears me fit nhi hote he is liya ears me pain hone lag jata he baki sab kuch badiya he,4.0 out of 5 stars
"Im writing this review after years of usage. I use it almost everyday. And its working really good. Sound quality for music, videos and other recordings are good. But call quality is almost zero other than that no single con. Must buy without second thought.",5.0 out of 5 stars
Sound quality is good. Build is very aesthetic. Length of the wire is shorter making it little difficult to use with laptop,4.0 out of 5 stars
"Been using it from some times now. Good quality, good sound quality, easy to use.

The Only problem I found is this is bit tight while using. But eventually it will get comfortable I guess.",4.0 out of 5 stars
"A decent product from boat.
Built: 6/10
Sound: 7/10
Mic: 6.5/10

1. Good sound quality
2. Good bass
3. No real noice cancellation, just increase the volume to block outer noice.
4. Built quality is really good. I am a rough user and till now it has absorbed all the torture.
5. Wire is basic rubber and plastic and it scares me everytime it is stuck somewhere.
6. The mic is good and had a button on it. The mic will absorb all the surrounding noise without cancelling it.
7.Very compact
8. Over all its good 🐨🐨",4.0 out of 5 stars
I bought this headphones for ₹549. And it is worth for money,5.0 out of 5 stars
"I've been using these for a little over 2 weeks. Not regularly, but often enough. To note, I really like boAt products having used them over last 3 years, first with RockerZ Bluetooth headphones, then the basic wired ones and now this and this would be my first time using over the ear headphones. Here is my review

Pros :
- Price point (for sale at ₹599)
- strong and very durable jack
- with mic
- long cable for convenience
- can be compacted into a small carrying size, as shown in image
- definitely has got strong noise cancellation and high bass, however, if one is not used to it (like myself) it can be annoying at times

Cons:
- maybe a little uncomfortable. For those buying a more expensive ones , maybe comfort levels would be better
- the padding could be a little better.",4.0 out of 5 stars
"If you don't wanna read my thoughts about these headphones, I have written OVERALL CONCLUSION at the bottom for those who just wanna get to the point of my review.

I cannot say this one of the best headphones I have ever heard. But for the price I can say this is a very good value for money headphone. But if you are like me, an audiophile obsessed with high quality stuff. Then these headphones would not really impress you.

However, I WOULD say these headphones have a Bass much higher than headphones I have heard even than the Sony MDR-XB450 EXTRA BASS.
I can tell you one thing, if you listen to bass heavy and don't really mind a sound quality that may sound bellow average, then these headphones would satisfy you very much!

I wouldn't recommend using these headphones on a phone unless your phone has a very good DAC, which basically means a good sound card, which would give you the best out of these headphones.

However, let me explain why exactly I feel these headphones could have been better. The main thing is the sound quality. I could hear some vocals getting a bit underwhelmed, and the overall quality of the sound wasn't too good. Now I'm not saying thats unacceptable considering the price. For the price these headphones would definitely blow you away.
But I bought these headphones as a spare, portable and durable solution for video editing. Now I am disappointed by the overall sound quality, but they do the job well enough, and I cannot complain about the bass. The bass in these headphones are absolutely incredible and almost a steal for this price.
The 40mm drivers allow the sound of these headphones to sound much wider and more fuller than you would get in a pair of earphones.

OVERALL CONCLUSION:

Buy these headphones if you want amazing vibrating incredible thumping bass. Good portability since this headphone folds up which is a nice feature. It has good build quality, and feels very sturdy, has an in-built microphone and has decent level of noise isolation/comfort.

Overall - a very good buy for the price you pay, and a steal price if you are a bass lover.

***Remember that you WILL need an AMP or a good in-built sound card in your device in order to get the best out of these headphones. ***",4.0 out of 5 stars
"I got my boat 900 on republic day sale for Rs549. Its the best buy I had. The sound is impressive from boat 900 headphones.

One small problem the headphones are bit tight, after 1 to 2 hours continuous use, my ear's had pain..

Good product go for it..",4.0 out of 5 stars
"This headphones is best on this price, its full of bass with good sound quality, it also having the strong jack which connect the headphone to your devices which make it more easy to carry your device in whatever way you want without damaging your headphone's jack.",5.0 out of 5 stars
Superb quality sound. Loved it..,4.0 out of 5 stars
I got defected item,3.0 out of 5 stars
Best budget headphones with decent sound,5.0 out of 5 stars
Not comfortable for long hours otherwise all qualities are perfect,4.0 out of 5 stars
Boat,5.0 out of 5 stars
It's a nice product and has an awesome bass quality. I am enjoying songs because it produces better sound quality.,4.0 out of 5 stars
Review after 3 months of use: Mic is not working properly with Microsoft teams and skype. With phone its working fine so far. This cant be used for official work. Basically its a Indian product with Chinese components.,3.0 out of 5 stars
 No .1. under 750 rs,5.0 out of 5 stars
Best price and best quality,5.0 out of 5 stars
"Very good quality for the price range. The sound and the mike quality is good. I use it on my laptop for work purpose, talking to my team on Google Hangouts or Microsoft Team.

Pros:
1. The sound and mike quality is good. This was the main purpose of buying this headphone.
2. The springs attached at the end of the pin, helps pull out the wire in case it gets pulled. This is really helpful.
3. The cable is pretty long

Cons: None

Small concern: On long usage I experience some discomfort on my ears and have to remove the headset for a while. But it is an indicator how snugly it fits over your ears.

The best one perhaps in this price range.

I have a standby PTRon Studio Lite Stereo Sound Wired Headphones. Compared to PTRon, Boat is a true winner in terms of reliability and sound quality.",4.0 out of 5 stars
"I BOUGHT THIS FOR 900RS AND VERY HAPPY
ITS ALREADY 1 YEAR WITH HEADPHONES AND STILL ROCKING ,WHEN U GET THESE HEADPHONES FOR APPROX 3 DAYS U WILL GET FELLING THAT HEADPHONES ARE PRESSING YOUR EARS BUT AFTER 3 DAYS YOUR HEADPHONES WILL ACCUSTUM WITH YOUR EARS AND MAKE U COMFOTRABLE

SO ENJOY BY BUYING IT",4.0 out of 5 stars
Good product & its worth.,4.0 out of 5 stars
"I have purchased it on ₹749.
Sound quality is OP🔥 only problem is sound leaking, the person sitting near to you can clearly hear the sound if you're in high volume.
Mic is good.
Comfortable is also good, even in summer it is very little sweaty, maybe after using more than 90 mins you will get sweat.",5.0 out of 5 stars
😍🥰,4.0 out of 5 stars
"Well designed, good sound quality and noise cancellation. I loved the experience",4.0 out of 5 stars
It’s very good product at this price,4.0 out of 5 stars
Good,5.0 out of 5 stars
Only drawback was loss of sound on one side after 6 Months of usage.,4.0 out of 5 stars
"Bass is amazing although mids does sound a bit muddy. I like the wire and build quality and for 600 cant get better than that. Good for listening music/videos etc.
However, what is the point when you cant wear these for more than 30 mins!! My ear starts paining especially left earlobe coz of these headphones. Seems like a design fault, as they swivel towards outside than inside. This creates a less flexible option when you wear it. So trying to use left side on right ear and right side on left ear. That has sorted the issue a bit!
Good for 20 to 30 mins music.. Dont try it for playing games... Your earlobes will hurt and pain.. Plus using the opposite sides of left/right of headphones to ease pain... will cause immense confusion of footsteps in games!!",4.0 out of 5 stars
I use it for my meetings. Does the job well with good sound quality and noise reduction. Go for it!,4.0 out of 5 stars
"I got the product for Rs 600/- during Republic day sale. It is well worth the money.
However, ears start paining after long term use.
Bass effect is good. It doesn't have noise cancellation. You can buy it at this price as there are hardly any better options available under Rs 1,000/-",4.0 out of 5 stars
"I got the product for Rs 600/- during Republic day sale. It is well worth the money.
However, ears start paining after long term use.
Bass effect is good. It doesn't have noise cancellation. You can buy it at this price as there are hardly any better options available under Rs 1,000/-",4.0 out of 5 stars
It's worth product,4.0 out of 5 stars
"Good bass quality at optimum sound level
But feel distortion for some contents.",4.0 out of 5 stars
Bass is so good at this range,4.0 out of 5 stars
One of the best Overhead earphone I have ever used. The only negative is Noise cancellation. Wholly a worthy product to buy and enjoy. You'll not feel even a slight ear pain for around 3-4 hrs. After that you'll feel some uncomfortably.,5.0 out of 5 stars
"They aren't great and at this price I would have expected the sound quality to be higher but yes, they work and they work well. It's fits perfectly well on my ears and don't feel like my ears are on fire. Decent Buy",4.0 out of 5 stars
Quality product. Very good quality,4.0 out of 5 stars
"Not lying, Best budget headset, With some songs that I like I got to hear more details of the song with bass-boosted , Its like fire with the phonk song called ''Close Eyes'' By DVRST , that bass is so sick in this headset, Writing this after quite a while using this now, The ear pain isn't much a big problem its just a little ear pain for 1 minute if you wore it for 4-5 hours, not much a deal, The folding is incredible. And the sound quality I don't even need to say, It also comes with a boat sticker written ''#boAthead'' on it. Just buy It , Cant expect more with this price, what more to expect?",5.0 out of 5 stars
Nice,5.0 out of 5 stars
"This product has a very short lifespan. IN spite of taking care storing it carefully in a safe enclosure, the product stopped working before a span of 12 years !!! Shocking. There is no physical damage to the product.",4.0 out of 5 stars
Microphone is not working when it is connected to pc. I am facing the problem from the very first day.,3.0 out of 5 stars
"It has been two years I've been using this product and I listen lot of songs and nothing is damaged till now, they are working fine and sound quality is great just they are not too comfy but at this price point it's dad of all headphones",5.0 out of 5 stars
"Short of length compared to bass head 900 model. Its good but because of this, using with laptop is challenging. Also its creates little discomfort when using as it sweats around ears when using. Don't feel good. Sound wise good but not a great model compared to 900",3.0 out of 5 stars
Good and quality,4.0 out of 5 stars
I have been using these headphones since 2.5 years . Godd build quality with outsranding noise. I recommend to buy these headphones.,5.0 out of 5 stars
The product looks good. It has very good sound but the sound can be heard by people nearby. My ears have been hurting after a 15 minutes of use. overall the product is good. It is too much bass for me.,4.0 out of 5 stars
"The functioning is very good. The only problem I faced was it gets heated after a use of even less than 2 hrs. Apart from that, product is good.",4.0 out of 5 stars
I am using this from more than one year...i have experienced good bass and good sound quality...after using 3-4months i faced trouble on the connector part..the helpline service is very good ..they picked the damaged item from my home and replaced with in 7 days with a new product...the 2nd one is running very well still ...i will prefer you guys to buy this product at a 600-650rs range...if it shows higher price then wait for pocket friendly price and then buy...overall one of the best wired headphone under 650rs,4.0 out of 5 stars
"Uff i cannot explain about the sound quality it's superb. Yes there's a thing which can annoy the user the sound of this headphone spread outside since the outer layer of earcups are mettalic gril but only when you listen in lound sound quality orelse it's superb and one thing the product I ordered this is on not accurate but somewhat near to june and using it for 4 to 5 months I've experienced the sound quality and all not like ordering today and getting delivery or product the day it's delivered and writing review like anything oooww it's good it's that no! It's been enough time to review this product.
When I was I don't how but came in a mood of playing with this headphone and just rotated it like anything and it stopped working from one side and I remembered it has a warranty so I mailed the company and they resolved all my problems and accepted the return of this product and they replaced it within 2 weeks and now I've got the new product I so satisfied with this product and services.

LOVE IT❤❤❤❤",5.0 out of 5 stars
Value for money,4.0 out of 5 stars
My son using this ear phone to attend online classes. Only problem ear pad area is small,4.0 out of 5 stars
Like,4.0 out of 5 stars
X-lent🎶🎶🔊🔊,4.0 out of 5 stars
"The quality of the product seems good and its portable but the fit is lose, the noise cancellation is as decent as it can be on a lose fit. My mum really liked it so i guess that gives it a plus point. Also the bass stands up to the mark.",4.0 out of 5 stars
Good quality,5.0 out of 5 stars
"Good product, but not excellent",4.0 out of 5 stars
 Like but please repair or replacement because mic is not working properly so I request you,3.0 out of 5 stars
"Its wonderfull! This headphone is much worth than its prize. I am using it for past 8 months And it still looks and works wonderfully. Note: The audio quality of this headphones is ditermined by your laptops/mobail's settings and audio quality. I am Used It also for ecco divises, There you can hear its orjinal quality. I can clearly say, gamers, music lovers, moovies lovers go for it! Its base and sarroundings are also apreesiatable. Its strips are good.",5.0 out of 5 stars
"Using it for the past 6 months, Still working fine and sound quality is very good for the price.
The only issue is that it can't be used for longer duration as it gives ear pain, can be fixed by loosening the headphones by keeping it stretched for 1-2 days.",4.0 out of 5 stars
Multi-media,5.0 out of 5 stars
Yes as you saw on the title this pair of glamorous headphones does its job very well. This is my second time buying this product first time was on sep 2019 amd I loved that pair since..bit unfortunately it broke few months ago but nonetheless I bought it again the same exact one...and let me tell you something this pair of headphones is a piece of glorious bassy audio..I love it it's the go to headphone for me and probably it will stay that way.. nonetheless just go for it! It has bass it is durable it's Everything it promises to be..that's all,5.0 out of 5 stars
Speaker is well put . It got flexibility as well,5.0 out of 5 stars
Very nice,4.0 out of 5 stars
Nice one,4.0 out of 5 stars
Good bass,4.0 out of 5 stars
Good bass,3.0 out of 5 stars
Good bass,4.0 out of 5 stars
A very good otearphone,5.0 out of 5 stars
The headphones are not as big as it looks in the picture. The quality of sound is pretty good. Have to test the mic yet. Only hitch is the ear pad and head pad have soft leather which eventually are not gooing to last long but at the price bought its worth it still. Would recommend buying it though,4.0 out of 5 stars
"Super item
Run perfectly",4.0 out of 5 stars
"If you use a good device then even the cheapest music devices can produce nice sound...... Don't make your mind that cheap products are of bad quality.......THESE BOAT BASSHEADS 900 ARE THE ""BEST BUDGET HEADPHONES"" UNDER 1000",5.0 out of 5 stars
Bass quality is good,4.0 out of 5 stars
Good product and the sound quality is also very good. But calling experience is not that good. Voice is not very loud. Rest is fine.,5.0 out of 5 stars
the only problem is leather getting torn easily,3.0 out of 5 stars
"It is a must buy , as it is a value product",5.0 out of 5 stars
"As expected, Boat never lets you down. Amazing clarity and sound quality, be it attending calls or playing your favourite numbers! You are never dissatisfied with a #Boatbuy!",5.0 out of 5 stars
"I am from Sonipat, Haryana. Last month i purchased JBL headphone for Inr.1999 but those were absolutely rubbish compared to this Boat head phone costing 1/3 of JBL head phone. Basis my one week's use i can say that the product is absolutely value for money at Inr.650. I like the way the manufactured have been careful thought in minute design of the product.

This is 2nd product of BOAT i am using ( other being phone charger connector in charge ) so far and both of them have been excellent experience.",5.0 out of 5 stars
"I don't recommend this headset for any use. It's below average as per sound quality, no noise cancellation as well as need to hold mic near your mouth else opposite person can't hear your voice",2.0 out of 5 stars
"It's a good product, best quality.",5.0 out of 5 stars
 It's best product at this price range but it's not much comfortable as after 1/2 hour ear starts paining,4.0 out of 5 stars
"(Ok so, headphones you buy should be based on who you are (music producer, audio engineer, DJ or a regular person).
For non-music produces (normal people):
This headphone is ideal for you. Please don't go for studio-quality or expensive headphones for only listening to music (because expensive headphones are for music producers and require a huge amount of power that can't be used with mobile). It comes with a small microphone in one of the wires, is foldable (easy to store even in small bags). BUT, the ear cups are really small to my ears, get heated quickly, so you can't wear it for a long time comfortably. This headphone can be used with all devices and doesn't need a lot of power like the expensive ones. And if you listen to podcasts, I don't recommend it because it is uncomfortable to wear and has bad noise cancellation feature. But if you use headphones for meetings and listening to music, this is perfect for you.

For music producers and mixing engineers:
I do not recommend these headphones for you. Because if we see the frequency response, it plays sounds from 20-10000 Hz (as far as I can hear). But it plays bass sounds more than other frequencies which can make you biased and wrong decisions while making music and mixing/mastering. Anywhen it comes to power, it is 80 ohms. So please don’t buy ANY cheap headphones for music producing and I recommend buying headphones that have frequency response clearly mentioned (20Hz to 20000Hz is good) with 250 ohms. Such studio-quality headphones are not cheap though. You can see more studio-quality headphone suggestions for producer s on YouTube.
Hope this helps :)",3.0 out of 5 stars
"Positive:
Good sound clarity, Hi-quality product, Good fit for ears and head,soft pads,good bass, thicker wire and good AUX, spring in AUX is good for long life of item, highly attractive design. Easy returns and refunds.
AMAZON SERVICES ARE VERY GOOD AND SATISFIED.(NOT PRODUCTS).
Negatives:
This item not for long use ,when we use long time get start pain in our ears. Hi lose of battery persentage in mobiles. 'L'-shaped AUX is always good for mobiles.We can't use heardphone while laying on the bed,it is most difficult for sleeping, Not the item goes to little brother's hand next day he gives you two one-sided headphones.
AFTER 4 DAYS THE HEADPHONE STOPPED WORKING.THIS PRODUCT IS WASTE.",4.0 out of 5 stars
In ear very tight grip,3.0 out of 5 stars
Good bass quality,4.0 out of 5 stars
Very nice product,4.0 out of 5 stars
"* Best Headphone for Seeing films in mobile,to listen music,and to hear the footsteps of enemy in game like PUBG/BGMI/FF/COD etc
*Headphone is good but we will feel pain in ears while we wear for a long time.
* There is a problem in mic,if we are playing PUBG/BGMI/FF/COD with this headphone,we need to put the mic near to the mouth to hear our voice.
If we kept mic little bit from mouth ,the voice will become low and our teammates couldn't hear it",4.0 out of 5 stars
"Noise cancellation average. I think boat can do itbetter improve.
Thank you ❤️",5.0 out of 5 stars
Got it for 599 and these are one of the best headphones in this price. Iam using this for attending calls in teams in laptop during WFH. Mic is good quality not the best. Serves the purpose for which I bought it. I can't say about bass quality. It is a tight fit headphones so iam having pain on outer ear if I use it for 30 minutes continuously.,4.0 out of 5 stars
