review,rating
Using these headphones since last 4 months. Very Good Quality Headphones and offers a great bass considering the price range.,5.0 out of 5 stars
Really uncomfortable and it hurt when you use it for more then a minute.,1.0 out of 5 stars
I m us,4.0 out of 5 stars
No complain regarding the product. Everything is good considering the price.But having a bigger ear cup would be nice.,4.0 out of 5 stars
You may experience little uncomfortable after long use over the ears.,4.0 out of 5 stars
"Bought it in Amazon Navratri sale at 699! This is the best thing in this price range. A Budget headphone like this should have two quality, sound and comfort, and it has both of them. Looks good too!! One thing, a wider over the head band would look even more beautiful but anyways, it does the job.
Note: Buy only from trusted seller like Appario or cloudtail.",4.0 out of 5 stars
Noise cancellation is the only worst part.other wise all things are fine.,5.0 out of 5 stars
Not bad 599,4.0 out of 5 stars
Nice one....no noise cancellation got it at 599 in offer. Good for calls not for music,4.0 out of 5 stars
good to use but it cause ear pain.,3.0 out of 5 stars
"This is my first day of using boat headset.
Bass:10/10
Noice cancellation:3/10
Sound quality:10/10
Overall:8/10",4.0 out of 5 stars
They were too small in size so I returned them😬,1.0 out of 5 stars
Good as per price.,4.0 out of 5 stars
"Best product of boat.When it is 'bout boat then there is nothing to elucidate 'bout it's sound quality nd bass,,however this product is my apple of eye down to it's light weight",5.0 out of 5 stars
"It is a good product. The sound quality is fine but it doesn't have that extra bass as mentioned by them. But it sure does have decent sound quality.
But there are no details available on warranty policy",4.0 out of 5 stars
"Voice was low and not audible, speaker were okish",2.0 out of 5 stars
"boAt bassheads (black, wired, with in-line mic)
Delivery : 10/10
Product : 9.5/10
The only 0.5 I took was because : i would like to say if you're going to use it for a long time period, maybe go for something else. OnLY I found it a bit tempting to wear for more than 2 hours.
Else everything is perfect cuz it's boat, come on :) this price range, this is the most gorgeous headphones I've ever had!
I totally recommend this.",5.0 out of 5 stars
"Headphone is good, not fitting properly to ear. After few minutes getting Ear pain due to headphone is covering ear skin and gets pain. Sound quality average.
Bass quality and sound not extraordinary and not worst also. My biggest problem is headphone is pressing ear skin and getting pain",3.0 out of 5 stars
Not sure abou cable. So far good.,3.0 out of 5 stars
"The product is really good. Great Audio quality, good bass are some its pros. The noise cancellation, however, is not that good.

However, there are two things that I didn't like about this one. The first is that It is a bit tight out of the box (as most of the reviews tell) and it starts hurting your ears after long usage.
The Second is that the extension part, when extended, is sharp and if you are one of those who tend to put their headphones around their neck when not using, believe me, the sharp edges WILL CAUSE IRRITATION.

Other than that, this is a great deal and you should definitely go for it if the cons aren't big for you.",4.0 out of 5 stars
Very nice quality it's awesome product sound amazing.😊 I'm happy with this product.,4.0 out of 5 stars
been using this headphones for daily calls. Good build and quality. No on/off mic button on the wire.,5.0 out of 5 stars
It's really nice for simple music listening and online class for kids.,4.0 out of 5 stars
"Did not expect this to go bad so soon, bought this in January 2022 and already lost sound in one ear cup. Trying to claim warranty",2.0 out of 5 stars
I recommend to buy but if your ears are big so it can be small for but for kids it's perfect,4.0 out of 5 stars
I can't put them on freely... I think this is a drawback....good sound quality.,4.0 out of 5 stars
I didn't face any problem . The sound was good and it was correct for my head size .,4.0 out of 5 stars
Go for it if you want buy best bass wired head phones,4.0 out of 5 stars
GOOD PRODUCT,4.0 out of 5 stars
"It's been a few months since I started using this. Initially it was too tight on the ears, but now it is comfortable. Sound quality and microphone quality are good. So far, there are no problems, and it seems like a sturdy product. It has a one-year warranty, which is comforting (if the warranty is serviced as promised). Overall, definitely value for money. Excellent for online classes.",5.0 out of 5 stars
value for money,5.0 out of 5 stars
Worthy,4.0 out of 5 stars
Build quality is good. But sound quality is just average but according to price it's ok.,4.0 out of 5 stars
The quality is nice I use for listening music gaming and also for study use its great you can buy no doubt that it is wrong thing or product do purchase….,5.0 out of 5 stars
"Poor quality, better go for sony",2.0 out of 5 stars
"Apart from the decent sound and very good bass ,The Built is quite sturdy...",4.0 out of 5 stars
"Other person hardly hear our voice when talking thru mic. There is a lot of background noice and mic crack sounds.
I put plaster to the mic and attached it to the band..
Worst experience",2.0 out of 5 stars
"Quality, packaging, delivery are satisfactory. Seems to be a little frail. good product at this price.",4.0 out of 5 stars
"I'll give an above average rating for the product after 1 month use. The length of the wire is longer than expected, which makes it hard to carry around. Except the length of the wire, the product is great. I use it to connect to system and mobile for work and music respectively. Good product with sound quality and bass. Noise cancellation needs a little improvement.",4.0 out of 5 stars
"Boat Basshead 900, which i got in 800rs. Awesome Headphone with great base and fabulous Sound quality. good length of wire.Easy to Handle and Very light weight.You can easily make youtube videos it cancels most of the noises and reduces too much of background noises.Just Go for it if you have Budget under 1000. but if you budget around 1500rs then go for boat Rockerzz....🔥🔥",4.0 out of 5 stars
"I've using the product for almost 14 months, it has a good sound quality and amazing bass.
However it got damaged after 2 months use.
Within 2 months, the plug pin outer body came apart and within 3 months problem with one side of the speaker.
After 5 months the leather like covering start to peel of and within 1 week the item reached a pathetic condition by its looks. Also the outer covering of the cable torn and peeled off.

And now both the speakers stopped working and I am really struggling with it. So disappointed and frustrated.",2.0 out of 5 stars
Awesome product. Go blindly.,5.0 out of 5 stars
The bass quality of the headphones are very good but the sound is not so good.,4.0 out of 5 stars
Long life and better quality,5.0 out of 5 stars
Very good,5.0 out of 5 stars
Works for my TV. Cable length is short for such usage but I bought a connecting cable separately. Fully Satisfied with the purchase.,5.0 out of 5 stars
Very nice sound quality,4.0 out of 5 stars
Ear cushions are poor quality,4.0 out of 5 stars
"Working fine, as my daughter has not complained till now any thing. She is happy to use it.",4.0 out of 5 stars
Nice product,4.0 out of 5 stars
"NEVER EVER LET THE CUSHIONING PART TOUCH ANYTHING WHILE KEEPING IT ON STRETCHING, just turn the earcups, its okay if it rests onto the metal grill/net while stretching. (Follow the image)
Regarding the tightness of the headphone, ears getting hot and hurting ears, yes these issues exist but follow stretching shown in the image, it will be bearable after a while.
Regarding sound quality : One will never get expected sound quality unless they tweak equiliser to their individual taste, which is subjective.
I use Viper4Android and it blows my listening experience.
Materail quality is good.",4.0 out of 5 stars
"So I'm giving a review after using this earphone for a month, First thing i noticed is it's fitting is not that good, Music quality is very good above average but fitting issue is there... One more thing.. i don't know it's only with my product but it's left side headset is too loose compared to right one... And after a month I'm facing some issues like sometimes when i'm moving my head sound is cutting like there is a loose cable connection within the headset... I don't know how long my headphones will last but hoping for good...",2.0 out of 5 stars
Best product from Boat and suggested by apni dukan Amazon.,5.0 out of 5 stars
The headphone gives a awesome output of sound quality and bass is decent for this price. The build quality is quite decent. However it feels some sort of discomfort on ears after about half an hour of usage. But the quality is ok. the length and the quality of the wire is also good. The headphone is ultimately worth for the amount u pay.,4.0 out of 5 stars
"Awesome sound quality
Nice beats
Very light weight",5.0 out of 5 stars
"It has got a good sound quality
also the voice is high.
It is good for ears if we use by lower volume.
It has got heavy Bass.That gives a gd feel for music and gaming.U will get the real feeling of gaming.Only thing is that i dont fee lany noise cancellation and i am not bothering about it and i just needed to give a right review thays why i had mentioned it.It is very much flexible and also foldable. we can make it very small.Its giving no pain to ears even after 2-3hrs use.
Giving gd comfort
Overall very niz product....",5.0 out of 5 stars
"It been a 3 weeks that I bought this product. However, there is no sound on the right side of headphone only left side is working.",1.0 out of 5 stars
Nice,5.0 out of 5 stars
"I like it's bass
It's tangle free wire cable is super durable.
Sound quality is superb",5.0 out of 5 stars
Using it from 1 year it is still in good condition the product at its price point is best,5.0 out of 5 stars
Bass is not good. I had to alter the sound settings in my device to get the bass feel. Also noise from outside seeps in.,2.0 out of 5 stars
"1st day i was very happy to have a boat headset but now i am disapointed bcz after 1 month of use ,speakers sounds a little low and base is down but at this price range they are value for money",3.0 out of 5 stars
"The product is good ,But after sometime ear pain occurs",4.0 out of 5 stars
"The headset can be used on multiple devices like Mobile, Mi Box and PC. It has a very good bass and the experience is awesome.
When tried making Teams calls in PC it wasn't working as the people can't hear me and neither I can't hear them. Maybe I should connect an additional audio & mic splitter and check.
Satisfied with the product overall, value for money!",5.0 out of 5 stars
the product is very good to use i feel like im in another world by experiencing the bass and beat coming from the head phone one must try the headset it is way better than i tought,5.0 out of 5 stars
Have been using it for 9 months. Still really good,5.0 out of 5 stars
"Ok but Not so good as brand like sony
Ear phone material lightly tear after a year.",4.0 out of 5 stars
Everything is nice and good but the only problem is that after some time it hurts ears.,3.0 out of 5 stars
Only one thing to improve. Skullcandy over the ear has better sound clarity in same price. Would suggest to improve this.,3.0 out of 5 stars
I like it. Very powerfull.,5.0 out of 5 stars
"These headphones have good bass and sound quality at lower to medium volume.
The treble is decent; the vocals are understandable. A point to note though is, these headphones may get uncomfortable during extended use.
Casual listening to songs with heavy bass is what these headphones are made for.",3.0 out of 5 stars
"The headphones are very comfortable. I am able to wear it for 1-2 hours without any problems.

Sound quality for the price is quite good. And mic works very well. My conference calls are much smoother now.

Noise cancellation is quite good for a basic product. If one was looking in sub ₹1000 range, look no further. Its money well spent.

I have had this for over a month now. Physical look and feel is very good.",5.0 out of 5 stars
"After 2 months of usage. The build quality is really good I can wear them confidently without fear of breaking. Bass is good and you can actually feel the thumps in your ears. Only con I found given the price is sound leak and also they are little uncomfortable to wear when they are new for long hours after sometime it gets better.
Also the metal audio jack with spring protection is a good touch increases the durability.",5.0 out of 5 stars
"Vibration in ear
Can't enjoy bass in volume",3.0 out of 5 stars
Very good head phone... compatible for both office and songs listening. The product is good and the sound effect is also nice.,4.0 out of 5 stars
Good quality,5.0 out of 5 stars
Build quality is average... Sound quality is also average... Small ear pieces not comfortable for everyone... But worth for this price...,3.0 out of 5 stars
Good and soft ☺️ nice cable,5.0 out of 5 stars
"The best headphone in 800 Rs , Bass is too good. Also build quality Is very good.

Pros:
1. Excellent Sound Quality
2. Excellent Bass
3. The wire of Head phone is very thick
4. Steel sprint at the end of the wire to protect it from breaking at end due to bending.
5. Moving and adjustable speakers which can be folder and carried easily.
6. The weight is also not very heavy.
7. Best in pricing.
8. Very good build quality.

Cons:
None from my side.

Very Happy using this product .",5.0 out of 5 stars
No photo,1.0 out of 5 stars
It Sound's decent but cable is too long and not braded (feels very fragile and cheap quality cable) but matelic jack is very good and button position is wierd ..i think it is overpriced ..it price should be around not more than 500₹ .,3.0 out of 5 stars
It Sound's decent but cable is too long and not braded (feels very fragile and cheap quality cable) but matelic jack is very good and button position is wierd ..i think it is overpriced ..it price should be around not more than 500₹ .,5.0 out of 5 stars
Great sound quality both with music and call. Excellent bass. The only problem is durability after one year of use headphones broke at which cannot be repaired now I have to throw it even if it is working.,4.0 out of 5 stars
"Really awesome product. Very nice bass quality. I got it ₹599 in deal. In this price it is awesome product.
You can used it in your smartphone phone as well as Laptop also.
But not working in PC because Mic and speaker pins are seperate in computer and this Headphone have single 3.5 mm combined jack.

Noise cancellation is not good. Overall satisfied product in under 600",5.0 out of 5 stars
Sturdy design. No issues even after more than a year of rough usage.,4.0 out of 5 stars
Boat products are not good. This was the second product I bought and prior to this I purcased a Boat stone 1000. Both got spoiled after warranty period of one year. Also the service center is not easily contactable and helpful. Though the sound quality is good but reliability and longevity is not at all satisfactory.,3.0 out of 5 stars
"Everything is satisfactory. 👌
Only, at very high volume, sound quality get decreases.",4.0 out of 5 stars
"Very Nice product. But not able to use more than one hr. Its still tight , reading head.",4.0 out of 5 stars
"Always best in this price, no other headphone can replace it",5.0 out of 5 stars
"Sound quality is good, Bass is very good and wire quality is good.",4.0 out of 5 stars
"I bought these headphones back in June 2019. And I must say I didn't expect this much at this price.

First of all, the headphones look retro, this is what I like a lot.

Sound quality is AMAZING, again, AMAZING. The mids, highs are all amazingly balanced. The bass is not too overpowering to destroy the vocals. it's just perfect. Now it's been almost 2 years, the earcups are wearing out, but the headphones still sound great. They're very durable. After 1.5 years of use, I'm starting to hear some creaking noises, but it's fine. The jack is amazing too, has a spring so the wire does break there. It's not gold plated, but in real life usage, it doesn't make any big difference. The PVC material cable is tangle free. Everything is good. Just one problem: Comfort

Now don't get me wrong. You can use these for an hour, but after that it may start hurting your ears. just put them in your neck for 2 minutes, then wear again.

Mine haven't broken yet and are still working, but I they break I'll buy them again.

Sound quality: 5/5
Bass quality: 5/5
Durability: 5/5
Comfort: 4/5",5.0 out of 5 stars
"everything is nice but it causes deafness to ear,if used more than30 min and also its fitting is too tight that it will give a long term headache to you,personally will prefer the headphone first and not these headset",3.0 out of 5 stars
"Noise cancelation is not so good.
Sound quality is clear.
Bass effect is not good with quality of sound.",4.0 out of 5 stars
"Noise cancelation is not so good.
Sound quality is clear.
Bass effect is not good with quality of sound.",5.0 out of 5 stars
"i think its the hype that everyone talking about extra bass.... its just a normal overear headphone with a simple sound... NOT EXTRA BASS in it....
so if you like BASS? and know the real meaning of BASS... i recommend to check other options too",4.0 out of 5 stars
"This is my third boat bassheads 900, the sound quality is very good, and good for bass lovers.",5.0 out of 5 stars
Poor noise cancellation. The wire could've been thicker... Otherwise it's cool. Nice volume and sound quality and light weight and all.,3.0 out of 5 stars
"As already mentioned by someone else, its a bit tight in the beginning but as you start using it, it becomes loose and now it fits nicely. Since I wear specs it hurts a bit more if I wore it for a long time.",5.0 out of 5 stars
This is nice product,4.0 out of 5 stars
If you are buying it for its mic dont.Mic quality is not good fot making youtube videos.Sound quality is awesome and mic quality is average,4.0 out of 5 stars
"This produch met my all expections
But remember not to wear headphones for a long
Coz it causes pain in your ears",4.0 out of 5 stars
"The warranty is useless because. I as a user I can give you warranty of more than two years
Many YouTuber were saying In video that this are tight but,
in my experience I never fell any pain. I use them for heavy bass and heavy gaming.
At last:- At this time
You will not get better then this Headphones
In this price range",5.0 out of 5 stars
Awesome voice and life time,5.0 out of 5 stars
"Sound quality is nice, clear and crisp. Noise cancellation is good when indoors and works well if on high volume outdoors. A good pair for gaming on mobile devices, it's the best you can get cheaply, feels good while gaming just the pads aren't that comfortable, upper part of ears starts hurting a bit after 3 to 4 hours of Continuous usage.",4.0 out of 5 stars
These headphones are really nice. I wanted a good gaming headphone but didn't want to spend much so i thought of trying it out. I used to believe headphones with bass don't give the perfect sound of footsteps in FPS games but these headphones proved me wrong. If anyone is not willing to spend over ₹600 on headphones i recommend these headphones for gaming as well as daily usage. Bought it for ₹550/- totally worth the price.,5.0 out of 5 stars
"Bass, noise cancellation are super. The only problem is I can't use it for more than 30mins because it hurts my eat.",4.0 out of 5 stars
Gets tight on the ears. Painful if wearing for long time,3.0 out of 5 stars
"Noice cancellation (Badhiya🔥🔥🔥
Sound like smooth 🔥
Bass thik thaak🙌🏻",4.0 out of 5 stars
"At this price point, it is an excellent headphone and both bass & treble notes are not distorted even at higher volumes. Was almost as good as the JBL earbuds (much higher price point & in ear phones) that I have been using since a couple of years and the mid range delivery was even better than the JBL one.",5.0 out of 5 stars
"I purchased the item in March 2020, and I must say I am lukewarm with it. It stopped working in August, and had to be sent for repairs, the company took more than 1 month to ship it , repair it and then send it back. In March this year, the ears skins begin to come off. I would want an item to last longer perphaps.",3.0 out of 5 stars
"sound everything is perfect but only the thing is.i asked u wairless headphone ....
But it is waired headphone",4.0 out of 5 stars
Sound quality and other features are good but product material is delicate.,4.0 out of 5 stars
"Value for money.
This comes in a travel friendly pack.",4.0 out of 5 stars
"I was somewhat skeptical because I had never used boAt before, but it seemed pretty good from the product description, so I went for it. I must say, I'm extremely impressed with the quality of these headphones.

Pros:

1. Fantastic Sound Quality
2. Great Noise Cancellation Feature
2. Well Balanced Bass
3. Adjustable Bands and Rotatable Speakers allow for a very Snug Fit and Compact Storage
4. Very Robust
5. High Clarity Mic and Control Button

Cons:

1. Earmuffs Cause Slight Ear Pain After a While so Makes It Difficult to Wear for Too Long
2. Short Wire May Cause Some Length Problems
3. No Volume Control Buttons

Rating: 9.5/10, One of the Best Headphones in This Price Bracket",5.0 out of 5 stars
Good product. But bass is too high. So it will reduce sound clarity. For Bass sound lovers only.,4.0 out of 5 stars
Product is not good,1.0 out of 5 stars
"Nott satisfied with the quality of microphone
have issues in calling",4.0 out of 5 stars
Looking awesome sound clearity and bass super i love it....,4.0 out of 5 stars
Suond quality achi h,5.0 out of 5 stars
Good product...,5.0 out of 5 stars
Headset is excellent product but if the Headset having nosie cancelation its amazing product for that worthy,5.0 out of 5 stars
"Bought this headphone from the seller Appario retail.Seal was already broken when it was received.But headphones are in good condition ,like new(I guess). Headphone has good bass but misses treble sometimes,need to increase volume to get clarity of the sound.Padding is super soft and won't feel pain but don't expect much sound isolation.Good for the budget at Rs 700.",4.0 out of 5 stars
"Intial impression:Sound quality is good
As these are on ear headphones,the company should focus on improving the quality of cushion on these next generation headphones as they are hurting the ears
After 1 year usage: replaced product after 7 months and boat sent me a brand new one as the jack stopped to work in the previous one. Replace unit worked well for 5 months after that headset started to breaking...
Finally...
Sound quality-good
Built quality-bad
Value for money-yes
If you're a normal user and want to buy a on ear headset in budget than go for it",4.0 out of 5 stars
Headphones has small footprint. So they don’t bother you due to bulk of their size .,4.0 out of 5 stars
It's really amazing noise,5.0 out of 5 stars
Its mike is not working after 2 week,3.0 out of 5 stars
The sound quality of the speaker is good. However the functioning of the mic is poor. Most of the time the person listening on the oppsite side of the call is unable to hear what we are saying.,3.0 out of 5 stars
This product (boat basshead 900 )not working from last 15 days kindly give the solution as soon as possible,4.0 out of 5 stars
Its very nice. Only 1 concern is the ears start to hurt after half an hour continuous use.,4.0 out of 5 stars
In this price range dont expect too much this is average and quality is good of this product.,3.0 out of 5 stars
"Very awsome product I suggested you buy this product.
Best sound quality and bass quality in this product.
😍",5.0 out of 5 stars
"I bought it 2.5 years ago and writing review today.. around 5 months after purchasing it, all of a sudden it stopped working. I claimed the warranty and they had repaired it. And after that there wasn't any issue except the mic stopped working, so I can't use it for answering calls.
But till today it is my choice of use while watching movies, listening songs etc. Even the Bluetooth headset stands at 2nd place..
Bass and sound quality is 100%",5.0 out of 5 stars
Best for sound but not for ur ears,4.0 out of 5 stars
My headset work smoothly but recording voice has some problem.. I noticed it after a month will you replace it or repair it...,3.0 out of 5 stars
My headset work smoothly but recording voice has some problem.. I noticed it after a month will you replace it or repair it...,4.0 out of 5 stars
I like this headphones that's why I ordered 🙂.btw everything thing is great in this headphone.,5.0 out of 5 stars
Watch full Unboxing and review by me here - techies8.0,4.0 out of 5 stars
BETTER THAN ANY OTHER IN THIS RANGE JUST BUY THEM BLINDLY,4.0 out of 5 stars
Enjoying listening every single time.,5.0 out of 5 stars
 My from my video you can see that there are some sound leaks about the base it is good but it can be better so if you are looking at this price point you can go for it,4.0 out of 5 stars
"Really a great buy for college students it has a good anount of bass and treble, the mids are awesome and this is a rugged headphone for college use for jogging and working out but even if a drop of water touches your mic and its done but rest is built well, its a great buy if you get it for 599 or so but 1k is abit too much gor this better than this at 1 k would be mi basic or snile jamaica or cx 180",4.0 out of 5 stars
Worthy of Price,4.0 out of 5 stars
Muddy sound signature might be suitable if it's 2010,4.0 out of 5 stars
In this price is good,5.0 out of 5 stars
